ID,name,Descrição,description_pt,description_es,description_en,website,city,placesOfOriginNames,incidencyReach,parentHub,technologyType,purpose,incidencyType,themes,secondaryThemes,mecanismos,isOpenLicense,notes,"(sinais) Existem cadastramentos que derivam da iniciativa que acabou de classificar? Se sim, marque:",Quais? usar ;,Quais?,Quais?,Coletiva (HUB),Conexão e Diálogo ,Sensibilização,Formação,Produção de Conhecimento,Levantamento e Visualização de Informação,Fomento,Fiscalização e Monitoramento,Disseminação,Mobilização e Pressão,Contribuição e Colaboração
1,¿A DÓNDE VAN NUESTROS IMPUESTOS?,"El presupuesto es una herramienta de planificación y ejecución económico-financiera que nos muestra de qué manera se asignan los recursos públicos. Para poder profundizar su entendimiento, existen diversos criterios de clasificación del mismo, uno de las cuales lo constituye el agrupamiento por finalidad y función, que conlleva examinar los gastos en base a la naturaleza de los servicios que prestan las instituciones públicas.  Recorré la visualización y conocé cómo es el presupuesto de nuestra Ciudad.","El Presupuesto (O Orçamento) é uma ferramenta de planejamento e execução econômico-financeira que nos mostra como são destinados os recursos públicos. Para poder aprofundar seu entendimento, existem diversos critérios de classificação, entre os quais o agrupamento por finalidade e função, que leva ao exame dos gastos com base no tipo de serviço prestados pelas instituições públicas. Vá à visualização e conheça como é o orçamento de nossa cidade.","El presupuesto es una herramienta de planificación y ejecución económico-financiera que nos muestra de qué manera se asignan los recursos públicos. Para poder profundizar su entendimiento, existen diversos criterios de clasificación del mismo, uno de las cuales lo constituye el agrupamiento por finalidad y función, que conlleva examinar los gastos en base a la naturaleza de los servicios que prestan las instituciones públicas.  Recorré la visualización y conocé cómo es el presupuesto de nuestra Ciudad.","El Presupuesto (The Budget) is a tool for economic-financial planning and execution, which shows us how public resources are distributed. In order to deepen your understanding, there are several classification criteria, among which the function to group data by finality or function, leading to examination of spending based on the kind of service provided by public institutions. Go to the visualization and get to know how our city's budget works. ",http://gcba.github.io/presupuesto-gcba/,Buenos Aires,Argentina,Local,Cidade de Buenos Aires,Digital,Empoderamento,,Governo 2.0,Transparência e Accountability,", Abertura de dados, Serviço digital",,,,,,,,,,,,"Banco de dados, Gráficos",,Indicadores,,,
2,#CódigoAbierto_CC,"Plataforma alrededor de la cultura libre, procesos abiertos y sociedad red. Innovación y desorden. Transversalidades. Cultura libre. Tecnopolítica. Copyleft. Procomún. #P2P.","Plataforma sobre cultura livre, processos abertos e sociedade em rede. Inovação e desordem. Transversalidades. Cultura livre. Tecnopolítica. Copyleft. Procomún.#P2P","Plataforma alrededor de la cultura libre, procesos abiertos y sociedad red. Innovación y desorden. Transversalidades. Cultura libre. Tecnopolítica. Copyleft. Procomún. #P2P.","Platform focused on free culture, open processes and connected society. Innovation and disorder. Transversalities. Free culture. Technopolitics. Copyleft. Procomún. #P2P",http://codigo-abierto.cc,,América Latina e Caribe,Internacional,,Digital,Empoderamento,,Comunicação Independente,,", Pesquisa, Estudos, Análise de dados, Artigos, Grafos de rede",TRUE,,Outros,,,,,,,,"Pesquisa, Análise de Dados",Grafos de Rede,,,Portal de Notícias/Blog,,
3,#datapoa,O #DataPoA é o portal de dados abertos de Porto Alegre e tem como objetivo convidar a comunidade a participar do desenvolvimento de soluções inteligentes para a nossa cidade.,O #DataPoA é o portal de dados abertos de Porto Alegre e tem como objetivo convidar a comunidade a participar do desenvolvimento de soluções inteligentes para a nossa cidade.,El #DataPoA es el portal de datos abiertos de Porto Alegre y tiene como objetivo invitar a la comunidad a participar en el desarrollo de soluciones inteligentes para nuestra ciudad.,#DataPoA is the open data portal of the city of Porto Alegre and aims to invite the community to participate in the development of intelligent solutions for our city.,http://www.datapoa.com.br,Porto Alegre,Brasil,Local,Prefeitura de Porto Alegre; POA#Digital,Digital,Empoderamento,,Governo 2.0,Transparência e Accountability,", Banco de dados, Repositório, Serviço digital",,,Sinais,,,,,,,,,Banco de dados,,,,,
5,#GabineteAberto,"O #GabineteAberto é um programa semanal, ao vivo, transmitido pela internet e pela Rede SP Saudável, em que secretários da gestão pública são convidados a falar sobre os temas de suas respectivas pastas. Mas não se trata de uma fala hierarquizada: jornalistas e blogueiros da mídia independente, especialistas e ativistas são chamados para entrevistar as autoridades e trazer à tona as demandas da sociedade em relação às políticas públicas envolvidas.","O #GabineteAberto é um programa semanal, ao vivo, transmitido pela internet e pela Rede SP Saudável, em que secretários da gestão pública são convidados a falar sobre os temas de suas respectivas pastas. Mas não se trata de uma fala hierarquizada: jornalistas e blogueiros da mídia independente, especialistas e ativistas são chamados para entrevistar as autoridades e trazer à tona as demandas da sociedade em relação às políticas públicas envolvidas.","El #GabineteAberto (#Gabinete Abierto) es un programa semanal, en vivo, transmitido por internet y por la Rede SP Saudável (Red SP Saludable), en que secretários de la gestión pública son invitados a hablar sobre los temas de sus respectivas demandas. Pero no se trata de un habla jerarquizada: periodistas y blogueros de medios independiente, especialistas y activistas son seleccionados para entrevistar a las autoridades y traer al público las demandas de la sociedad en relación a las políticas públicas envueltas.","#GabineteAberto (#OpenOffice) is a weekly live show, broadcast over the internet and by Rede SP Saudável (Healthy São Paulo Network) in which public management secretaries are invited to talk about the themes of their respective work. But it is not a hierarchic speech: journalists and independent bloggers, specialists and activists are called to interview these authorities and bring up society's demands in relation to the public policies being developed. ",http://saopauloaberta.prefeitura.sp.gov.br/index.php/conheca-o-gabineteaberto/,São Paulo,Brasil,Local,São Paulo Aberta,Social,Empoderamento,,Governo 2.0,Transparência e Accountability,"Debate, Mediação / Facilitação, Entrevista, Mandato interativo",,,,,,,,"Eventos (Seminário, Fórum, Colóquio, Conferência, Debate, Roda de Conversa e encontros )",,,,,,,Transmissão,,Mandado Interativo
6,#GolPolítico,Una aplicación de Twitter que detecta cuándo tuiteas algo relacionado con el Mundial y acompaña inmediatamente ese tuit con otro relacionado con la discusión en el Senado sobre la reforma energética y otras más que se están desarrollando ahí mismo,"Um aplicativo de Twitter que detecta quando é escrita uma mensagem relacionada ao Mundial e acompanha imediatamente esse tweet com outro, relacionado à discussão no Senado a respeito da reforma energética e outras que estejam acontecendo ali.",Una aplicación de Twitter que detecta cuándo tuiteas algo relacionado con el Mundial y acompaña inmediatamente ese tuit con otro relacionado con la discusión en el Senado sobre la reforma energética y otras más que se están desarrollando ahí mismo,"A Twitter app which detects when a message relating to the Mundial (FIFA World Cup) is written and immediately follows this tweet with a new one, relating to the discussion in the Senate about the energy reform and others that are being carried out there.",http://golpolitico.com/,,México,Nacional,Flock Mexico; Animal Político; Éramos Tantos,Digital,Empoderamento,,Comunicação Independente,,", Ativismo digital",,Buscar Hubs:- Flock Mexico - http://flock.mx/sobre-flock/- Eramos Tanto - http://eramostantos.com.mx/- Animal Político - http://www.animalpolitico.com/,,,,,,,Campanha de Sensibilização,,,,,,Transmissão,,
7,#Internetlibreve.org,"Por un internet libre de censura y bloqueos en Venezuela. Demandamos inmediato cese de acciones del gobierno de la República Bolivariana de Venezuela contra los ddhh, y en especial contra la libertad de expresión, en la forma de control de contenidos, bloqueo de sitios web,  degradación deliberada del servicio, impedimento de acceso a Internet o cualquier acto que violente el ejercicios de los derechos en línea.","Por uma internet livre de censura e bloqueios na Venezuela. Demandamos o fim imediato das ações de governo da República Bolivariana da Venezuela contra os direitos humanos,especialmente contra a liberdade de expressão, sob a forma de controle de conteúdos, bloqueio de sites, degradação deliberada do serviço, impedimento do acesso à internet e qualquer ato que fira o exercício dos direitos online.","Por un internet libre de censura y bloqueos en Venezuela. Demandamos inmediato cese de acciones del gobierno de la República Bolivariana de Venezuela contra los ddhh, y en especial contra la libertad de expresión, en la forma de control de contenidos, bloqueo de sitios web,  degradación deliberada del servicio, impedimento de acceso a Internet o cualquier acto que violente el ejercicios de los derechos en línea.","For a censorship-free and block-free internet in Venezuela. We demand the immediate end of the government actions carried out by the Bolivarian Reupublic of Venezuela against human rights, specially against freedom of speech, in the form of content control, site blocking, deliberate degradation of service, obstruction of access to the internet and any other act which might harm the exercise of online rights.",http://internetlibreve.org/,,Venezuela,Nacional,Venezuela Inteligente; Espacio Público,Digital,Incidência,Não Específicado,Participação Cidadã,,", Ativismo digital, Abaixo-assinado, Campanha",,hub Espacio público http://espaciopublico.org/index.php/programas,Hubs,,,,,,,,,,,,,"Abaixo-assinado, Campanha de Mobilização",
8,#JusticiaYa,"Plataforma ciudadana permanente y abierta para informarnos, expresarnos y organizarnos. Somos los jóvenes detrás del evento de #RenunciaYa del #25A y #16M","Plataforma cidadã permanente e aberta para nos informarmos, expressarmos e organizarmos. Somos os jovens por trás dos eventos #RenunciaYa de #25A e #16M.","Plataforma ciudadana permanente y abierta para informarnos, expresarnos y organizarnos. Somos los jóvenes detrás del evento de #RenunciaYa del #25A y #16M","Permanent and open citizen platform for information, expression and organization. We are the young people behind the events of #RenunciaYa (#RenouncementNow) on #25A and #16M.",https://twitter.com/justiciayagt,,Guatemala,Nacional,,Digital,Incidência,,Participação Cidadã,Controle Social,", Ativismo digital, Campanha, Manifestação, Monitoramento",,Olhar https://twitter.com/justiciayagt e https://www.facebook.com/events/1480672592239942/ para encontrar outras hashtags (sinais) que estão sendo usadas para mobilizar a sociedade guatemalteca.,Sinais,,,,,,,,,,,,Transmissão,Campanha de Mobilização,
9,#LABiCBR - Laboratório Ibero-Americano de Inovação Cidadã / Brasil,"Laboratório de duas semanas, de 15 a 29 de novembro de 2015, para desenvolvimento de projetos selecionados de forma colaborativa com a ajuda de mentores, mediadores e assistentes técnicos, para além de um grupo de 100 colaboradores.","Laboratório de duas semanas, de 15 a 29 de novembro de 2015, para desenvolvimento de projetos selecionados de forma colaborativa com a ajuda de mentores, mediadores e assistentes técnicos, para além de um grupo de 100 colaboradores.","Laboratorio de dos semanas, de 15 a 29 de noviembre de 2015, para el desarrollo de proyectos seleccionados colaborativavamente con la ayuda de mentores, mediadores y asistentes técnicos, que va más allá de un grupo de 100 colaboradores.","Two week-long laboratory, from November 15th to 29th 2015, for developing projects selected collaboratively with the help of mentors, mediators and technical assistants, besides over 100 collaborators. ",http://www.ciudadania20.org/pt-pt/labicbr/,,Brasil,Regional,Inovação Cidadã da Secretaria-Geral Ibero-Americana (SEGIB); Ministério da Cultura do Brasil; Medialab-Prado,Social,Empoderamento,,Cultura Política,,", Hackaton, Laboratório",,"1. Avaliar método ""laboratório""2. Apoiadores: - Agência Espanhola de Cooperação Internacional para o Desenvolvimento (AECID)- Fundación Unidos en Red, - ","Hubs, Financiadores",,,,,"Eventos (Seminário, Fórum, Colóquio, Conferência, Debate, Roda de Conversa e encontros )",,,,,Aceleração e Incubação,,,,Co-criação
10,#Lima Quiere Cultura,"Lima Quiere Cultura"" es una plataforma ciudadana abierta que busca supervisar la continuidad de las políticas culturales de Lima","Lima Quiere Cultura (Lima Quer Cultura) é uma plataforma aberta de cidadania, que busca observar a continuidade das políticas culturais em Lima. ","Lima Quiere Cultura"" es una plataforma ciudadana abierta que busca supervisar la continuidad de las políticas culturales de Lima","Lima Quiere Cultura (Lima Wants Culture) is an open citizenship platform, which aims to observe the continuity of the cultural policies in Lima, Peru. ",https://www.facebook.com/limaquierecultura/info?tab=page_info,Lima,Peru,Local,,Social,Incidência,,Controle Social,Participação Cidadã,"Debate político, Campanha, Manifestação, Infoativismo",,,,,,,,"Eventos (Seminário, Fórum, Colóquio, Conferência, Debate, Roda de Conversa e encontros )",,,,,,Indicadores,,"Protesto, Campanha de Mobilização",
11,#SeFecharAGenteOcupa,Série de informações mapeadas colaborativamente sobre a intenção que o Governo do Estado de São Paulo tem em fechar 95 escolas sob sua responsabilidade.,Série de informações mapeadas colaborativamente sobre a intenção que o Governo do Estado de São Paulo tem em fechar 95 escolas sob sua responsabilidade.,Serie de informaciones mapeadas colaborativamente sobre la intención que el Gobierno del Estado de São Paulo tiene para cerrar 95 escuelas bajo su responsabilidad.,Series of collaboratively mapped information about the intentions of the Government of the State of São Paulo of closing 95 schools that are under its responsibility.,https://www.google.com/maps/d/u/1/edit?actionButton=1&authuser=1&mid=zBp5Xxw6d19Q.kAAtE2nnXItg,São Paulo,Brasil,Local,,Digital,Empoderamento,,Transparência e Accountability,Comunicação Independente,", Georrefenciamento, Crowdsourcing, Cobertura Colaborativa",,,,,,,,,,,,Georeferenciamento,,,Cobertura Colaborativa,,
12,1ra Hackatón Miraflores,"La Comuna Distrital celebrará el Día Mundial del Internet con la 1ra Hackatón de Miraflores, para dar a conocer los compromisos de su Carta Municipal de Gobierno Abierto, y a la vez promover la participación, colaboración e innovación ciudadana, a través del uso de Datos Abiertos. ","A Comuna Distrital celebrará o Dia Mundial da Internet com a primeira Hackatón de Miraflores, para tornar públicos os compromissos de sua Carta Municipal de Governo Aberto, e para promover a participação, colaboração e inovação dos cidadãos através do uso de Dados Abertos.","La Comuna Distrital celebrará el Día Mundial del Internet con la 1ra Hackatón de Miraflores, para dar a conocer los compromisos de su Carta Municipal de Gobierno Abierto, y a la vez promover la participación, colaboración e innovación ciudadana, a través del uso de Datos Abiertos. ","Comuna Distrital (District Commune) will celebrate World Internet Day with the first Hackathon held in Miraflores, to make public the commitments of its Municipal Letter of an Open Government, and to promote the participation, collaboration and innovation of citizens via the use of Open Data.",http://www.miraflores.gob.pe/_contenTempl1.asp?idpadre=8614,Miraflores,Peru,Local,Prefeitura de Miraflores,Social,Incidência,,Governo 2.0,Transparência e Accountability,", Concurso, Hackaton",TRUE,,,,,,,Hackton,,,,Banco de dados,Concurso,,,,
13,3de3,Iniciativa que busca reconstruir la confianza ciudadana a través del compromiso y transformación de la clase política en nuestro país: funcionarios y políticos que antepongan los intereses de México a los suyos.,Iniciativa que busca reconstruir a confiança dos cidadãos a partir do compromisso e da transformação da classe política em nosso país; funcionários e políticos que coloquem os interesses do México acima dos próprios.,Iniciativa que busca reconstruir la confianza ciudadana a través del compromiso y transformación de la clase política en nuestro país: funcionarios y políticos que antepongan los intereses de México a los suyos.,Initiative which aims to rebuild the confidence of citizens through the commitment and transformation of the political class in our country; employees and politicians who will put Mexico's interests above their own.,http://3de3.mx/#/,México DF,México,Nacional,Mexicano para la Competitividad (IMCO); Transparencia Mexicana,Digital,Incidência,,Transparência e Accountability,Controle Social,", Ativismo digital, Crowdsourcing",false,Fiquei com dúvida no tipo de método que usam,"Hubs, Financiadores",,,,,,,,,"Banco de dados, Georeferenciamento",,Indicadores,,Petição,
14,A Batata precisa de Você,"‘A batata precisa de você’ é uma ocupação regular, semanal no largo da batata na cidade de São Paulo. Toda sexta-feira  promovem atividades culturais aliadas de conversas sobre temas urbanos que impactam a vida na cidade e seus cidadãos. É aberto para qualquer pessoa que queira participar ou promover atividades. O movimentos surgiu da frustração de pessoas com  as audiências públicas da Subprefeitura de Pinheiros em São Paulo. ","‘A batata precisa de você’ é uma ocupação regular, semanal no largo da batata na cidade de São Paulo. Toda sexta-feira  promovem atividades culturais aliadas de conversas sobre temas urbanos que impactam a vida na cidade e seus cidadãos. É aberto para qualquer pessoa que queira participar ou promover atividades. O movimentos surgiu da frustração de pessoas com  as audiências públicas da Subprefeitura de Pinheiros em São Paulo. ","‘A batata precisa de você’ ('La batata te necesita') es una ocupación regular, semanal en el Largo de la Batata en la ciudad de São Paulo. Todos los viernes  promueven actividades culturales aliadas a charlas sobre temas urbanos que impactan la vida en la ciudad y sus ciudadanos. Es abierto a cualquier persona que quiera participar o promover actividades. El movimento surgió de la frustración de personas con las audiencias públicas de la Alcaldía del barrio de Pinheiros en São Paulo.","A batata precisa de você (Batata needs you) is a regular occupation, happening weekly in Batata Square, in the city of São Paulo. Every Friday, the square holds cultural activities and conversations about urban themes which affect life in the city and its citizens. It is open to anyone who wants to participate or promote activities. The movement stemmed from the frustation of people with the public audiences of the Subprefecture of Pinheiros in São Paulo.",http://largodabatata.com.br/,São Paulo,Brasil,Local,A Cidade Precisa de Você,Social,Empoderamento,,Cultura Política,,"Roda de conversa, Ocupação, Atividades culturais, Vivência",,a cidade precisa de vc ja foi mapeado?,,,,,,,Atividades Culturais,,,,,,,Ocupação,
15,A Quiénes Elegimos,Conoce mejor a los Candidatos a Elecciones Municipales,Conheça melhor os candidatos às eleições municipais.,Conoce mejor a los Candidatos a Elecciones Municipales,Get to know your municipal election candidates better. ,http://www.aquieneselegimos.org.py/,,Paraguai,Local,CIRD; reAcción,Digital,Empoderamento,,Transparência e Accountability,,", Pedagogia política, Jogo, Relatório, Repositório, Serviço digital",TRUE,,,,,,,,Conscientização eleitoral,,,Banco de dados,,,,,Rankeamento
16,A Tu Nombre,"Desde DATA y Mirá Mamá trabajamos para construir una herramienta que permita visualizar en un mapa de Montevideo qué calles tienen nombre de mujer y, a su vez, quiénes fueron esas mujeres. El proyecto lo llevamos a cabo junto a un grupo de colaboradores/as que se acercaron a un Café de DATA.","Por meio do DATA e Mira Mamá (Olha Mamãe) trabalhamos para construir uma ferramenta que permita visualizar, num mapa de Montevidéu, quais ruas têm nomes de mulheres e quem foram estas mulheres. O projeto foi realizado por um grupo de colaboradores/as que se juntaram em um café de DATA.","Desde DATA y Mirá Mamá trabajamos para construir una herramienta que permita visualizar en un mapa de Montevideo qué calles tienen nombre de mujer y, a su vez, quiénes fueron esas mujeres. El proyecto lo llevamos a cabo junto a un grupo de colaboradores/as que se acercaron a un Café de DATA.","Via DATA and Mira Mamá (Look, Mom) we work to build a tool that will allow visualization, in a Montevideo map, of which streets are named after women and who were these women. The project was developed by a group of collaborators that got together in a DATA coffee meeting.",http://atunombre.uy/,Montividéu,Uruguai,Local,Datauy; Datos Abiertos,Digital,Empoderamento,Não Específicado,Transparência e Accountability,,", Georrefenciamento, Crowdsourcing",TRUE,,Hubs,,,,,,,,,"Banco de dados, Georeferenciamento, Gráficos",,,,,
17,A Tu Servicio,"A tu servicio es una herramienta que permiten obtener, visualizar y comparar datos de los diferentes prestadores de salud de Uruguay, para promover la toma de decisiones informadas de los/as usuarios/as y la transparencia del sistema. El surgimiento de este proyecto está vinculado a la apertura del período de Movilidad Regulada en el área de la salud (conocido como “corralito”) en febrero de cada año. Esta plataforma fue desarrollada por DATA y el Ministerio de Salud Pública. Fue financiada por el Ministerio de Salud Pública y el programa de pequeños apoyos de la Iniciativa Latinoamericana por los Datos Abiertos (ILDA), financiada por Avina Américas.","A Tu Servicio (A Seu Serviço) é uma ferramenta que permite obter, visualizar e comparar dados de diferentes prestadores de saúde do Uruguai, para promover uma tomada de decisão bem-informada pelos/as usuários/as e a transparência do sistema. O surgimento deste projeto está vinculado à abertura do período de Mobilidade Regulada na área da saúde (conhecido como ""corralito"") em fevereiro de cada ano. Esta plataforma foi desenvolvida pelo DATA e pelo Ministério de Saúde Pública. Foi financiado pelo Ministério de Saúde Pública e pelo programa de pequenos apoios da Iniciativa Latino-americana pelos Dados Abertos (ILDA), financiada pelo Avinas Américas.","A tu servicio es una herramienta que permiten obtener, visualizar y comparar datos de los diferentes prestadores de salud de Uruguay, para promover la toma de decisiones informadas de los/as usuarios/as y la transparencia del sistema. El surgimiento de este proyecto está vinculado a la apertura del período de Movilidad Regulada en el área de la salud (conocido como “corralito”) en febrero de cada año. Esta plataforma fue desarrollada por DATA y el Ministerio de Salud Pública. Fue financiada por el Ministerio de Salud Pública y el programa de pequeños apoyos de la Iniciativa Latinoamericana por los Datos Abiertos (ILDA), financiada por Avina Américas.","A Tu Servicio (At Your Service) is a tool which alllows the user to obtain, visualize and compare data from different health service providers in Uruguay, in order to promote well-informed decision-making by the users as well as system transparency. The beginning of this project is attached to the opening of a period of ""Regulated Mobility"" in the health area (know as ""corralito"") in February of each year. This platform was developed by DATA and by the Public Health Ministry, and by the program of small supports of ILDA (Latin American Initiative for Open Data), financed by Alvinas Américas.  ",http://atuservicio.uy/,Montividéu,Uruguai,Nacional,Datauy; Dirección General del Sistema Nacional Integrado de Salud,Digital,Empoderamento,,Governo 2.0,Transparência e Accountability,", Banco de dados, Infográfico, Monitoramento, Serviço digital",TRUE,,Hubs,,,,,,,,Análise de Dados,"Banco de dados, Gráficos",,Indicadores,,,
