210,Justicia y Género,"Justicia y Género es una herramienta de búsqueda de argumentos jurídicos con perspectiva de género utilizados por cortes nacionales e internacionales. Contiene una sistematización de buenas prácticas judiciales con enfoque de género, donde se clasifica los argumentos por país, jueces, instancias, contexto, resolución, argumentos e innovaciones legales, derechos y materia de derecho. Presenta el análisis de las sentencias seleccionadas y ofrece un acervo de referencias legales y bibliográficas sobre los derechos de las mujeres.","Justicia e Género (Justiça e Gênero) é uma ferramenta de pesquisa de argumentos jurídicos com perspectiva de gênero, usados pelos tribunais nacionais e internacionais. Ele contém uma sistematização de boas práticas judiciais com uma perspectiva de gênero, em que os argumentos são classificados por país, juízes, instâncias, contexto, resolução, argumentos e inovações legais, direitos e questões legais. Apresenta uma análise das sentenças selecionadas e oferece uma riqueza de referências legais e bibliográficas sobre direitos das mulheres.","Justicia y Género es una herramienta de búsqueda de argumentos jurídicos con perspectiva de género utilizados por cortes nacionales e internacionales. Contiene una sistematización de buenas prácticas judiciales con enfoque de género, donde se clasifica los argumentos por país, jueces, instancias, contexto, resolución, argumentos e innovaciones legales, derechos y materia de derecho. Presenta el análisis de las sentencias seleccionadas y ofrece un acervo de referencias legales y bibliográficas sobre los derechos de las mujeres.","Justicia y Género (Justice and Gender) is a tool to research legal arguments with gender perspective, used in national and international courts. It contains a systematization of good legal practices with gender perspective, in which arguments are classified by country, judge, instance, context, resolution, arguments as well as innovation concerning legal, rights and juridical issues. It presents an examination of selected setences and offers rich body of bibliography and legal references about women's rights.",http://justiciaygenero.org.mx/,,México,Internacional,Fundar; Equis Justicia para las mujeres,Digital,Empoderamento,Judiciário,Cultura Política,Transparência e Accountability,", Estudos, Repositório, Georrefenciamento, Ação judicial de interesse público",,,,,,,,,,,Sistematização de conhecimento,Banco de dados,,,,,
214,La Paz Cómo Vamos,"La Paz Cómo Vamos es una iniciativa ciudadana que realiza evaluaciones y seguimiento a los factores que inciden en la calidad de vida de los habitantes de la ciudad de La Paz. Su principal tarea es promover el acceso a la información pública, poniendo a disposición información actualizada, a través de indicadores técnicos y estudios de percepción ciudadana que permitan tener  una visión integral de los aspectos relacionados con la calidad de vida de la ciudad.","La Paz Cómo Vamos (La Paz Como Vamos) é uma iniciativa civil que realiza avaliações e monitoramentode fatores que afetam a qualidade de vida dos habitantes da cidade de La Paz. Sua principal tarefa é promover o acesso à informação pública, fornecendo informações atualizadas através de indicadores técnicos e estudos de percepção pública, que possibilitem uma visão abrangente das questões relacionadas com a qualidade de vida na cidade.","La Paz Cómo Vamos es una iniciativa ciudadana que realiza evaluaciones y seguimiento a los factores que inciden en la calidad de vida de los habitantes de la ciudad de La Paz. Su principal tarea es promover el acceso a la información pública, poniendo a disposición información actualizada, a través de indicadores técnicos y estudios de percepción ciudadana que permitan tener  una visión integral de los aspectos relacionados con la calidad de vida de la ciudad.","La Paz Cómo Vamos (How Are We Doing La Paz) is a civil initiative that evaluates and monitors factors that affect life quality of La Paz citizens. Its main task is to promote public information access, providing technicians and public perception studies that allow a broader vision of issues related with life quality in the city.",http://lapazcomovamos.org,La Paz,Bolívia,Local,,Social,Incidência,Executivo,Controle Social,,", Campanha, Plano de metas, Monitoramento",,,,,,,,,,,,Banco de dados,,Indicadores,,Advocacy,
217,La Sociedad Responde,"La sociedad civil responde es una iniciativa que busca intervenir en el debate público para colocar una agenda civil de incidencia frente a la crisis de impunidad, corrupción y violaciones a derechos humanos que incluya propuestas alternativas de reformas legislativas, rediseño institucional y acciones concretas con base en lecciones aprendidas y experiencias exitosas de otros países que han pasado por crisis similares. ","La Sociedad Civil Responde (A Sociedade Civil Responde) é uma iniciativa que busca intervir no debate público para colocar uma agenda civil, enfrentando a crise de impunidade, corrupção e violações dos direitos humanos. Inclui propostas alternativas de reformas legislativas, redesenho institucional e ações concretas com base em lições aprendidas e experiências bem sucedidas de outros países que passaram por crises semelhantes.","La sociedad civil responde es una iniciativa que busca intervenir en el debate público para colocar una agenda civil de incidencia frente a la crisis de impunidad, corrupción y violaciones a derechos humanos que incluya propuestas alternativas de reformas legislativas, rediseño institucional y acciones concretas con base en lecciones aprendidas y experiencias exitosas de otros países que han pasado por crisis similares. ","La Sociedad Civil Responde (Civil Society Responds) is an iniative that seeks to intervene in the public debate to stablish a civil agenda, facing the impunity crisis, corruption and human rights violations. It includes alternative propositions for legislative reforms, institutional redesign and concrete action based in lessons learnt and well suceeded experiences in other countries that went through similar crisis.",http://www.sociedadresponde.org/,Ciudad de México,México,Nacional,Fundar Centro de Análisis e Investigación A.C.; Centro de Derechos Humanos Miguel Agustín Pro Juárez,Social,Incidência,,Participação Cidadã,,"Mediação / Facilitação, Co-Criação, Seminário",false,"Tem uma lista gigantesca de Hubs na coluna da direita do ""Acerca de nosostros"".Também tem o financiador: Fondo para los Derechos Humanos Mundiales",Hubs,,,,,"Eventos (Seminário, Fórum, Colóquio, Conferência, Debate, Roda de Conversa e encontros )",,,,,,,,"Abaixo-assinado, Petição, Campanha de Mobilização",Co-criação
218,Laboratorio de Gobierno,"El Laboratorio de Gobierno es un equipo multidisciplinario del Gobierno de Chile, con un directorio compuesto por representantes de los siguientes Ministerios y Servicios: Interior-Subdere, Hacienda, Segpres, Economía, Desarrollo Social, Corfo y Servicio Civil.","O Laboratório de Gobierno (Laboratório de Governo) é uma equipe multidisciplinar do Governo do Chile, com uma diretoria composta por representantes dos seguintes Ministérios e serviços: Subsecretaria de Desenvolvimento Regional e Administrativo, Finanças, Secretaria Geral da Presidência, Economia, Desenvolvimento Social, Corporação de Fomento da Produção e Serviço Civil.","El Laboratorio de Gobierno es un equipo multidisciplinario del Gobierno de Chile, con un directorio compuesto por representantes de los siguientes Ministerios y Servicios: Interior-Subdere, Hacienda, Segpres, Economía, Desarrollo Social, Corfo y Servicio Civil.","Laboratório Gobierno (Government Laboratory) is a multidisciplinary team of Chile Government, with a board composed of the following Ministries and services: Subsecretary of Administrative and Regional Development, Finances. General Secretariat of the Presidency, Economy, Social Development, Production Fomentation Corporation and Civil Service.",http://lab.gob.cl/,,Chile,Local,Governo do Chile,Social,Empoderamento,Não Específicado,Governo 2.0,,", Design Thinking",,,Sinais,,,,,"Eventos (Seminário, Fórum, Colóquio, Conferência, Debate, Roda de Conversa e encontros )",,,,,,,,,"Co-criação, Crowdsourcing"
220,LAS PASARELAS DE LA INDUSTRIA DE LA VIGILANCIA Y SU RELACIÓN CON LOS GOBIERNOS MEXICANOS: ESCENARIOS 2015,Relatorio de vigilancia del gobierno Mexicano,Relatório de vigilância do governo Mexicano,Relatorio de vigilancia del gobierno Mexicano,Mexican Government Vigilance Laboratory,http://contingentemx.net/2015/10/22/las-pasarelas-de-la-industria-de-la-vigilancia-y-su-relacion-con-los-gobiernos-mexicanos-escenarios-2015/,,México,Nacional,ContingenteMX; Enjambre Digital,Digital,Empoderamento,,Controle Social,Cultura Política,", Relatório",,,,,,,,,,,"Estudo, Análise de Dados",,,,,,
221,LATINNO,"LATINNO is the first comprehensive database documenting participatory innovations in Latin America. The project is collecting data on participatory initiatives implemented in all twenty Latin America countries since 1990. It comprises practices involving deliberation, direct democracy, e-democracy and new forms of citizen representation. The LATINNO project is coordinated by Prof. Dr. Thamy Pogrebinschi, Senior Researcher of the Democracy and Democratization Department at the Berlin Social Science Center (WZB) in Berlin.","LATTINO é a primeira base de dados compreensível documentando inovações em políticas de participação na América Latina. O projeto está coletando dados sobre iniciativas de participação implementadas nos 20 países da América Latina desde 1990. Reunindo práticas que envolvem deliberação, democracia direta, e-democracia e novas formas de representação do cidadão. O projeto LATTINO é coordenado pelo professor doutor Thamy Pogrebinschi, pesquisador sênior do Departmento de Democracia e de Democratização do WZB - Berlin Social Science Center (Centro de Ciências Sociais de Berlim) em Berlim.","LATTINO es la primera base de datos comprensible que documenta innovaciones en políticas de participación en la América Latina. El proyecto colecta datos sobre iniciativas de participación implementadas en 20 países de América Latina desde 1990. Reuniendo prácticas que envuelven deliberaciones, democracia directa, e-democracia y nuevas formas de representación del ciudadano. El proyecto LATTINO es coordenado por el profesor doctor Thamy Pogrebinschi, investigador senior del Departamento de Democracia y de Democratización del WZB - Berlin Social Science Center (Centro de Ciencias Sociales de Berlín) en Berlín.","LATINNO is the first comprehensive database documenting participatory innovations in Latin America. The project is collecting data on participatory initiatives implemented in all twenty Latin America countries since 1990. It comprises practices involving deliberation, direct democracy, e-democracy and new forms of citizen representation. The LATINNO project is coordinated by Prof. Dr. Thamy Pogrebinschi, Senior Researcher of the Democracy and Democratization Department at the Berlin Social Science Center (WZB) in Berlin.",http://www.latinno.net/,,Alemanha,Regional,,Social,Empoderamento,,Participação Cidadã,,", Pesquisa, Estudos, Análise de dados, Relatório, Banco de dados",,Democracy and Democratization Department at the Berlin Social Science Center,Hubs,,,,,,,,"Pesquisa, Estudo",,,,,,
222,Legado del Bicentenario,"Al comienzo de las celebraciones por los doscientos años del proceso de Emancipación Oriental la Bicentenario Uruguay definió tres ejes en los cuales trabajar: Un pasado para recordar, Un presente para vivir y Un futuro para proyectar. En estos años hemos recordado los principales hitos históricos del proceso independentista así como las más diversas manifestaciones de nuestra cultura. Es decir, nos propusimos reflexionar sobre la larga búsqueda de doscientos años hasta llegar a ser quienes somos.","No início das comemorações dos duzentos anos do processo do Emancipação Oriental, a Bicentenário Uruguai definiu três eixos de trabalho: Um passado para lembrar, um presente para viver e um futuro para projetar. Nestes anos, lembramos das principais marcos históricos do processo de independência, bem como das mais diversas manifestações da nossa cultura. Ou seja, nos propusemos a refletir sobre a longa busca de duzentos anos para virmos a ser quem somos.","Al comienzo de las celebraciones por los doscientos años del proceso de Emancipación Oriental la Bicentenario Uruguay definió tres ejes en los cuales trabajar: Un pasado para recordar, Un presente para vivir y Un futuro para proyectar. En estos años hemos recordado los principales hitos históricos del proceso independentista así como las más diversas manifestaciones de nuestra cultura. Es decir, nos propusimos reflexionar sobre la larga búsqueda de doscientos años hasta llegar a ser quienes somos.","In the beginning of celebrations of two hundred years of Oriental Emancipation, Uruguay Bicentennial  defined three work axes: A past to remember, A present to live and A future to design. We remembered the main historic landmarks of the independence proccess and of the diverse manifestations of our culture. That is, we proposed to reflect about the long two hundred years search to become who we are today.",http://bicentenario.uy,,Uruguai,Nacional,DATA,Digital,Empoderamento,,Governo 2.0,Cultura Política,", Pedagogia política, Repositório",,Apenas um repositório das diversas leis do Uruguai. Seria foda se essa plataforma fosse wiki e as pessoas pudessem colaborar e editar todas as leis do pais.,,,,,,,,,Sistematização de conhecimento,,,,Portal de Notícias/Blog,,
223,Legislando,O Legislando é o aplicativo da Rede Nossas Cidades que permite que os cidadãos participem ativamente do processo de criação de leis em suas cidades. Aqui você pode fazer muita coisa para que um projeto de lei ou PL (nome carinhoso que adoramos usar!) vire de fato uma lei.,O Legislando é o aplicativo da Rede Nossas Cidades que permite que os cidadãos participem ativamente do processo de criação de leis em suas cidades. Aqui você pode fazer muita coisa para que um projeto de lei ou PL (nome carinhoso que adoramos usar!) vire de fato uma lei.,El Legislando es una aplicación de la Rede Nossas Cidades (Red Nuestras Ciudades) que permite que los ciudadanos participen activamente en el proceso de creación de leyes en sus ciudades. Aquí tú puedes hacer muchas cosas para que un proyecto de ley - o PL - (¡nombre cariñoso que nos gusta mucho usar!) se transforme de hecho en una ley.,Legislando (Legislating) is the app of Rede Nossas Cidades (Our Cities Network) that allows citizens to participate actively of lawmaking process in their cities. Here you can take many actions for a bill of law or PL (law project) (cute nickname we adopted!) to become in fact a law.,http://legislando.nossascidades.org,,Brasil,Local,Rede Nossas Cidades,Digital,Incidência,"Legislativo, Executivo",Participação Cidadã,,", Abaixo-assinado, Manual, Consulta popular, Legislação participativa",,,,,,,,,,,,,,,,Advocacy,Legislação Participativa
224,Ley de Lobby,"Viene a transparentar el lobby y las gestiones de intereses particulares ante autoridades y funcionarios, estableciendo como su deber registrar audiencias o reuniones, los viajes y los regalos.","Visa dar transparência ao lobby e aos esforços de interesses particulares face a autoridades e funcionários, estabelecendo como seu dever registrar audiências ou reuniões, viagens e presentes.","Viene a transparentar el lobby y las gestiones de intereses particulares ante autoridades y funcionarios, estableciendo como su deber registrar audiencias o reuniones, los viajes y los regalos.","We aim to bring transparency to lobby and private interest efforts interacting with authorities and public employees, stablishing as its duty to register audiences and meetings, travels and gifts.",http://leydelobby.cl/,,Chile,Nacional,Ciudadano Inteligente,Digital,Incidência,,Cultura Política,Transparência e Accountability,", Pedagogia política, Manual, Monitoramento",,www.infolobby.cl é o site de repositório,Sinais,,,,,,,Manual,,,,,,"Advocacy, Campanha de Mobilização",
225,Liberdade Digital,Repositório de documentos sobre liberdade digital,Repositório de documentos sobre liberdade digital,Repositorio de documentos sobre libertad digital,Document repository about digital freedom.,http://artigo19.org/liberdadedigital/,,Brasil,Nacional,Artigo 19,Digital,Empoderamento,,Cultura Política,,", Pedagogia política, Estudos, Livros, Análise de dados, Relatório, Repositório",,,,,,,,,,,Sistematização de conhecimento,Banco de dados,,,Portal de Notícias/Blog,,
226,Lista de Diputados,"Conoce a los candidatos a diputados para el Congreso de la República,sus datos personales, biografía, historial de trabajo y posición política.","Conheça os candidatos a deputados para o Congresso Nacional, seus dados pessoais, biografia, história de trabalho e posição política.
","Conoce a los candidatos a diputados para el Congreso de la República,sus datos personales, biografía, historial de trabajo y posición política.","Get to know the candidates to National Congress, their personal data, biography, work history and political views.",http://mcn.org.gt/listado-de-diputados/,,Guatemala,Nacional,Movimiento Civico Nacional,Digital,Incidência,,Transparência e Accountability,Participação Cidadã,", Pedagogia política, Análise de dados, Repositório, Infográfico, Votação",,,,,,,,,,,Sistematização de conhecimento,Banco de dados,,,,,
227,Livre Acesso,Acreditamos que o acesso à informação pode ser uma importante ferramenta na luta pela garantia de outros direitos humanos. Acesse as páginas para conhecer mais sobre cada tema e deixe seu comentário!,Acreditamos que o acesso à informação pode ser uma importante ferramenta na luta pela garantia de outros direitos humanos. Acesse as páginas para conhecer mais sobre cada tema e deixe seu comentário!,Creemos que el acceso a la información puede ser una importante herramienta en la lucha por la garantía de otros derechos humanos. ¡Acceda a las páginas para conocer más sobre cada tema y deje sus comentarios!,We believe access to information can be an important tool in the struggle to guarantee human rights. Access the pages to know more about each theme and leave your comment!,http://livreacesso.net/,,Brasil,Nacional,Artigo 19,Digital,Empoderamento,,Transparência e Accountability,Cultura Política,", Pedagogia política, Manual, Index/Indicadores, Pesquisa, Estudos, Análise de dados, Relatório, Repositório, Infográfico, Monitoramento",,,,,,,,,,,Sistematização de conhecimento,Banco de dados,,,Portal de Notícias/Blog,,
228,Mandato Coletivo Piracicaba,"A construção da democracia participativa começa com a educação política e participação cidadã de todos. Colocar em prática o Mandato Coletivo é um desafio para todos aqueles que acreditam ser possível mudar a forma de fazer política em nossa cidade. Este é um espaço de divulgação e reflexão sobre as ações do vereador Paulo Camolesi (PV), representante da proposta na Câmara de Vereadores de Piracicaba, e dos demais grupos que estruturam o Mandato Coletivo.","A construção da democracia participativa começa com a educação política e participação cidadã de todos. Colocar em prática o Mandato Coletivo é um desafio para todos aqueles que acreditam ser possível mudar a forma de fazer política em nossa cidade. Este é um espaço de divulgação e reflexão sobre as ações do vereador Paulo Camolesi (PV), representante da proposta na Câmara de Vereadores de Piracicaba, e dos demais grupos que estruturam o Mandato Coletivo.","La construcción de la democracia participativa comienza con la educación política y la participación ciudadana de todos. Colocar en práctica el Mandato Colectivo es un desafío para todos aquellos que creen que es posible cambiar la forma de hacer política en nuestra ciudad. Este es un espacio de divulgación y reflexión sobre las acciones del concejal Paulo Camolesi (PV), representante de la propuesta en la Cámara de los Concejales de Piracicaba, y de todos los demás grupos que estructuran el Mandato Colectivo.","The construction of participative democracy starts with political education and citizen participation. To put in practice Mandato Coletivo (Collective Mandate) is a challenge for those who believe it is possible to change how politics is done in our city. This is a space of promotion and reflection about city councilman Paulo Camolesi (PV - Green Party), who represents Collective Mandate's proposition in Piraciba city Council along other groups focused in this project's structuring.",http://mandatocoletivopiracicaba.blogspot.com.br/,Piracicaba,Brasil,Local,Gabinete do Vereador Paulo Camolesi,Social,Incidência,,Governo 2.0,Participação Cidadã,", Mandato interativo",,,,,,,,,,,,,,,,,Mandado Interativo
229,Manual Dados Abertos,"Este manual foi projetado para governos que querem abrir dados, mas pode ser usado por qualquer pessoa que queira saber mais dos aspectos técnicos, sociais e políticos dos dados abertos. Aqui se discute por que abrir dados, o que são dados abertos e como abrir dados de governo.","Este manual foi projetado para governos que querem abrir dados, mas pode ser usado por qualquer pessoa que queira saber mais dos aspectos técnicos, sociais e políticos dos dados abertos. Aqui se discute por que abrir dados, o que são dados abertos e como abrir dados de governo.","Este manual fue proyectado para gobiernos que quieran abrir datos, pero puede ser usado por cualquier persona que quiera saber más sobre los aspectos técnicos, sociales y políticos de los datos abiertos. Aquí se discute por qué abrir datos, qué son los datos abiertos y cómo abrir datos del gobierno.","This manual was projected for governments that want to open data, but it can be used by anyone who want to know more about technical, social ans political aspects of open data. Here it is possible to discuss why, what and how of open public data.",https://commons.wikimedia.org/wiki/File:Manual_Dados_Abertos.pdf,,Brasil,Nacional,CGI.br; W3C; Laboratório Brasileiro de Cultura Digital,Social,Empoderamento,"Legislativo, Judiciário, Executivo",Transparência e Accountability,Cultura Política,", Pedagogia política, Manual, Livros",TRUE,,Hubs,,,,,,,Manual,Sistematização de conhecimento,,,,,,
230,Manual de Guerrilha do Servidor Público,"A Guerrilha foi criada com o objetivo de ajudar os Servidores Públicos de todo o Brasil a mudarem o cenário atual, removendo o papo político de cena e criando um ambiente de excelência para trazer cada vez mais benefícios à sociedade!","A Guerrilha foi criada com o objetivo de ajudar os Servidores Públicos de todo o Brasil a mudarem o cenário atual, removendo o papo político de cena e criando um ambiente de excelência para trazer cada vez mais benefícios à sociedade!","La Guerrilla fue creada con el objetivo de ayudar a los Funcionarios Públicos de todo Brasil para que cambien el escenario actual, removiendo el parloteo político y creando un ambiente de excelencia para traer, cada vez mas, ¡beneficios a la sociedad!","Guerrilha was created to help Public Employees of Brazil to change nowadays scenario, leaping off political gibberish and creating an environment of excellence to generate more and more benefits to society!",http://guerrilhadoservidor.com.br/,,Brasil,Nacional,Guerrilha do Servidor,Social,Incidência,Não Específicado,Cultura Política,,", Manual",,O Manual parece ser uma das iniciativas da Guerrilha do Servidorhttp://guerrilhadoservidor.com.br/,Hubs,,,,,,,Manual,Sistematização de conhecimento,,,,Transmissão,,
231,Manual de Jornalismo de Dados,Como jornalistas podem usar dados para melhorar suas reportagens,Como jornalistas podem usar dados para melhorar suas reportagens,Cómo periodistas pueden usar datos para mejorar sus reportajes.,How journalists can use data to improve their news reports.,http://datajournalismhandbook.org/pt/,,Brasil,Nacional,,Digital,Empoderamento,,Comunicação Independente,Transparência e Accountability,", Manual, Livros, Repositório",TRUE,,,,,,,,,Manual,Sistematização de conhecimento,,,,,,
232,Mapa da Transparência,Mapa da transparência do estado do Rio Grande do Sul,Mapa da transparência do estado do Rio Grande do Sul,Mapa de la transparencia del Estado de Rio Grande do Sul,Transparency map of Rio Grande do Sul State.,http://www.mapa.rs.gov.br/,,Brasil,Local,Governo do Estado do Rio Grande do Sul,Digital,Empoderamento,,Governo 2.0,Transparência e Accountability,", Index/Indicadores, Análise de dados, Infográfico, Serviço digital",false,,,,,,,,,,,Infográfico,,Indicadores,,,
