99,DataMX,La plataforma cívica de datos abiertos de MéxicoBuscamos organizar los datos abiertos de México.,A plataforma cívica de dados abertos do México. Buscamos organizar os dados abertos do México.,La plataforma cívica de datos abiertos de MéxicoBuscamos organizar los datos abiertos de México.,Mexico's civic platform of open data. We seek to organize Mexico's open data.,http://datamx.io/,,México,Nacional,Codeando México; Instituto Mexicano para la Competitividad; Oaxaca Transparente; Como Vamos Nuevo León; OpenData.Mx; AVINA,Digital,Empoderamento,,Transparência e Accountability,Governo 2.0,", Banco de dados, Repositório",TRUE,,,,,,,,,,,Banco de dados,,,,,
100,Datea,"Datea es un espacio para compartir datos útiles con tu comunidad. En Datea, cada vecino es un datero que piensa en los demás, quiere cambiar las cosas y busca soluciones colectivamente.","Datea é um espaço para compartilhar dados úteis com sua comunidade. No Datea, cada vizinho produz informações e pensa nos outros, quer mudar as coisas e busca soluções coletivamente.","Datea es un espacio para compartir datos útiles con tu comunidad. En Datea, cada vecino es un datero que piensa en los demás, quiere cambiar las cosas y busca soluciones colectivamente.","Datea is a space to share useful data with your community. In it, each neighbor produces information and thinks about other people, about how to change things and pursues solutions collectively.",http://datea.pe/,,Peru,Nacional,La Factura; AVINA,Digital,Empoderamento,,Cultura Política,,", Oficina, Repositório, Georrefenciamento, Denúncia, Monitoramento",false,,,,,,,,,Manual,,Banco de dados,,Monitoramento Descentralizado,,,
101,Datos Bo,Esta es una iniciativa con el fin de crear un ecosistema de transparencia y confianza mediante la colaboración de la sociedad comprometida a colaborar compartiendo datos.,"Esta é uma iniciativa com o fim de criar um ecossistema de transparência e confiança mediante a colaboração da sociedade, comprometida a colaborar compartilhando informações.",Esta es una iniciativa con el fin de crear un ecosistema de transparencia y confianza mediante la colaboración de la sociedad comprometida a colaborar compartiendo datos.,"This is an iniative that proposes creating an ecosystem of transparency and trust with society's collaboration, commited to collaborate by sharing information. ",http://datos.bo/,La Paz,Bolívia,Nacional,Bolivia Tech Hub,Digital,Empoderamento,,Transparência e Accountability,Transparência e Accountability,", Banco de dados",,,Hubs,,,,,,,,Análise de Dados,"Banco de dados, Georeferenciamento",,,,,
102,Datos El Salvador,"Datoselsalvador.org es una de varias herramientas que hemos diseñado y ejecutado para promover la economía digital, el conocimiento abierto y la relevancia de atender a las TIC desde un enfoque integrador y estratégico.","Datoselsalvador.org é uma das várias ferramentas que temos desenvolvido e executado para promover a economia digital, o conhecimento aberto e a relevância de atender às tecnologias da informação e comunicação de um ponto de vista integrador e estratégico.","Datoselsalvador.org es una de varias herramientas que hemos diseñado y ejecutado para promover la economía digital, el conocimiento abierto y la relevancia de atender a las TIC desde un enfoque integrador y estratégico.","Datoselsalvador.org is one of the numerous tools we have been developing and activating in order to promote digital economy, open knowledge and the relevance of approaching information and communication technologies from an integrative and strategic point of view.",http://www.datoselsalvador.org/,,El Salvador,Nacional,Open Knowledge El Salvador,Digital,Empoderamento,,Transparência e Accountability,Governo 2.0,", Banco de dados, Repositório",TRUE,,,,,,,,,,,Banco de dados,,,,,
104,DatosPY,"Aquí la sociedad civil, la academia, las empresas y el gobierno disponen sus datos en formatos abiertos para usar, re-usar, y compartir de forma libre y gratuita.","A sociedade civil, a academia, as empresas e o governo dispõe de dados abertos para usar, reusar e compartilhar de forma livre e gratuita.","Aquí la sociedad civil, la academia, las empresas y el gobierno disponen sus datos en formatos abiertos para usar, re-usar, y compartir de forma libre y gratuita.","Here civil society, Academy, companies and govern are provided with open data to use, reuse and share freely and with no charge.",http://datos.org.py/,,Paraguai,Nacional,TEDIC,Digital,Empoderamento,,Transparência e Accountability,,", Banco de dados, Repositório",TRUE,,,,,,,,,,,Banco de dados,,,,,
105,De Guarda,O De Guarda promove vigílias eletrônicas para monitorar atividades governamentais no espaço público da cidade.,O De Guarda promove vigílias eletrônicas para monitorar atividades governamentais no espaço público da cidade.,El De Guarda promueve vigilias electrónicas para monitorear actividades gubernamentales en el espacio público de la ciudad.,De Guarda (On Watch) promotes eletronic look-outs to monitor governmental activities in city's public spaces.,http://deguarda.nossascidades.org/,Rio de Janeiro,Brasil,Local,Rede Nossas Cidades,Digital,Incidência,,Controle Social,,", Ativismo digital, Monitoramento",,,,,,,,,,,,,,Monitoramento Descentralizado,,,
106,De Olho,"O blog De Olho é o início do 1º projeto independente de acompanhamento da Câmara Municipal carioca. Aqui vamos explicar o passo-a-passo do funcionamento da Câmara, tocando nos pontos importantes, e sem a barreira do politiquês.","O blog De Olho é o início do 1º projeto independente de acompanhamento da Câmara Municipal carioca. Aqui vamos explicar o passo-a-passo do funcionamento da Câmara, tocando nos pontos importantes, e sem a barreira do politiquês.","El blog De Olho es el inicio del 1º proyecto independiente de acompañamiento de la Cámara Municipal carioca. Aquí vamos a explicar la secuencia del funcionamiento de la Cámara, tocando en los puntos importantes, y sin la barrera del pragmatismo político..","De Olho blog is the beginning of the first independent project to accompany Rio de Janeiro's municipal chamber. Here we will explay step by step how city chamber functions, getting into important topics and getting around technical language. ",http://deolho.nossascidades.org,Rio de Janeiro,Brasil,Local,Rede Nossas Cidades,Digital,Empoderamento,,Cultura Política,,", Pedagogia política, Tradução",,,,,,,,,,Manual,,,,,Portal de Notícias/Blog,,
107,De olho nas metas,"Criado por iniciativa da sociedade civil, o sistema De Olho nas Metas ajudará cidadãos e organizações da sociedade civil a acompanhar e monitorar o cumprimento de metas da prefeitura de São Paulo. ","Criado por iniciativa da sociedade civil, o sistema De Olho nas Metas ajudará cidadãos e organizações da sociedade civil a acompanhar e monitorar o cumprimento de metas da prefeitura de São Paulo. ","Creado por iniciativa de la sociedad civil, el sistema De Olho nas Metas (Supervisando las Metas) ayudará a ciudadanos y organizaciones de la sociedad civil a supervisar y monitorear el cumplimiento de las metas de la municipalidad de San Pablo.","Created from a civil society initiative, De Olho nas Metas (Watching the Goals) system will help citizens and civil society organizations to monitor the fulfillment of São Paulo's City Hall goals.",http://deolhonasmetas.org.br/,São Paulo,Brasil,Local,Rede Nossa São Paulo; AVINA; Eokoe; MIT Media Lab,Digital,Empoderamento,,Controle Social,Participação Cidadã,", Banco de dados, Georrefenciamento, Monitoramento",TRUE,,,,,,,,,,,"Banco de dados, Georeferenciamento",,Indicadores,,,
108,De olho no Legislativo,Um método para acompanhar mandatos parlamentares,Um método para acompanhar mandatos parlamentares,Un método para acompañar mandatos parlamentares,A method for monitoring parliamentary mandates.,http://www.votoconsciente.org.br/wp-content/uploads/2013/02/LIVRO-FINAL-_-MVC-KAS.pdf,,Brasil,Nacional,Movimento Voto Consciente,Digital,Empoderamento,,Cultura Política,,", Pedagogia política, Manual, Livros",false,,,,,,,,Campanha de Sensibilização,Manual,Sistematização de conhecimento,,,,,,
109,Declaración Patrimonial,Declaración Patrimonial de Enrique Peña Nieto,Declaração Patrimonial de Enrique Peña Nieto.,Declaración Patrimonial de Enrique Peña Nieto,Enrique Peña Nieto's Assets Declaration.,http://gobiernofacil.com/herramientas/declaracion-patrimonial-epn/,México DF,México,Nacional,Gobierno Fácil,Digital,Empoderamento,,Transparência e Accountability,Controle Social,", Banco de dados, Infográfico, Infoativismo",,,,,,,,,,,Sistematização de conhecimento,"Banco de dados, Gráficos",,Indicadores,,,
110,Declaraciones Juradas,El patrimonio de los funcionarios públicos de la Argentina,O patrimônio dos funcionários da Argentina.,El patrimonio de los funcionarios públicos de la Argentina,Argentinian employees patrimony.,http://interactivos.lanacion.com.ar/declaraciones-juradas#pd=0,,Argentina,Nacional,Poder Ciudadano; Fundación Directorio Legislativo; ACIJ,Digital,Empoderamento,,Transparência e Accountability,Controle Social,", Pesquisa, Relatório, Repositório, Monitoramento, Serviço digital",TRUE,,,,,,,,,,,"Banco de dados, Gráficos",,Indicadores,,,
111,Del Dicho al Hecho,Del Dicho al Hecho es un análisis detallado de las promesas establecidas por el gobierno y una revisión del estado de cumplimiento legislativo de éstas.,Del Dicho al Hecho (Do Dito ao Feito) é uma análise detalhada das promessas feitas pelo governo e uma revisão do estado do cumprimento legislativo destas.,Del Dicho al Hecho es un análisis detallado de las promesas establecidas por el gobierno y una revisión del estado de cumplimiento legislativo de éstas.,Del Dicho al Hecho (From Talk to Walk) is a detailed analysis of the promisses made by the govern and a revision of their legislative fulfillment.,http://deldichoalhecho.cl/,,Chile,Nacional,Ciudadano Inteligente,Digital,Incidência,,Controle Social,,", Index/Indicadores, Monitoramento",TRUE,,,,,,,,,,,Banco de dados,,Fact Checking,,,
112,Delibera,O Delibera é um plugin para WordPress para democracia online. Ele permite a discussão e deliberação de encaminhamentos relacionados a uma pauta por uma comunidade de usuários.,O Delibera é um plugin para WordPress para democracia online. Ele permite a discussão e deliberação de encaminhamentos relacionados a uma pauta por uma comunidade de usuários.,El Delibera es un plugin para WordPress para democracia en línea. Él permite la discusión y deliberación de secuencias relacionadas a una pauta por una comunidad de usuários.,Delibera is a WordPress plugin for on-line democracy. It allows user communities discussion and deliberation of ongoing matters related to a specific topic.,http://culturadigital.br/plataformascolaborativas/delibera-democracia-digital/,,Brasil,Nacional,CulturaDigital.BR,Digital,Empoderamento,,Participação Cidadã,,"Debate político, Votação",false,,,,,,,,,,,,,,,,Debate para consenso (a ver)
114,Democracia Digital,"Este evento é um espaço de diálogo entre academia, sociedade civil e governo em temas que são sensíveis à agenda de pesquisa Democracia Digital, tais como: transparência, accountability, participação, governo aberto, dados abertos, engajamento. Uma mesa redonda discutirá tópicos desta agenda, a partir da prática e visão dos debatedores. Os participantes do evento tomarão conhecimento do site Democracia Digital, que apresenta os resultados de um projeto desenvolvido em parceria pelas escolas de Direito e Administração em São Paulo da Fundação Getulio Vargas.","Este evento é um espaço de diálogo entre academia, sociedade civil e governo em temas que são sensíveis à agenda de pesquisa Democracia Digital, tais como: transparência, accountability, participação, governo aberto, dados abertos, engajamento. Uma mesa redonda discutirá tópicos desta agenda, a partir da prática e visão dos debatedores. Os participantes do evento tomarão conhecimento do site Democracia Digital, que apresenta os resultados de um projeto desenvolvido em parceria pelas escolas de Direito e Administração em São Paulo da Fundação Getulio Vargas.","Este evento es un espacio de diálogo entre academia, sociedad civil y gobierno en temas que son sensibes a la agenda de investigación Democracia Digital, tales como: transparencia, accountability, participación, gobierno abierto, datos abiertos, compromiso. Una mesa redonda discutirá tópicos de esta agenda,  desde la práctica y visión de los debatidores. Los participantes del evento van a conocer el sítio Democracia Digital, que presenta los resultados de un proyecto desarrollado en conjunto por las escuelas de Derecho y Administración en São Paulo de la Fundación Getulio Vargas.","This event is a space for conversations involving educators, civil society and government, approaching themes that are relevant to Democracia Digital (Digital Democracy) agenda, such as: transparency, accountability, participation, open govern, open data, engagement. A roundtable  discussion will take on topics from this agenda, based on debaters' practices and points of view. Democracia Digital's website will be divulgated so that participants can consult the results of this project developed in a partnership between Law and Administration schools of Fundação Getúlio Vargas in São Paulo.",http://ceapg.fgv.br/evento/democracia-digital,São Paulo,Brasil,Nacional,Fundação Getulio Vargas,Social,Empoderamento,,Cultura Política,,", Seminário",,,,,,,,"Eventos (Seminário, Fórum, Colóquio, Conferência, Debate, Roda de Conversa e encontros )",,,,,,,,,
115,Democracia e Redes Sociais,Curso Online sobre Democracia,Curso Online sobre Democracia,Curso en línea sobre Democracia,On-line course about democracy.,http://portal.redes.org.br/,,Brasil,Nacional,Escola de Redes,Digital,Empoderamento,,Cultura Política,,", Curso",false,,Hubs,,,,,,,Curso,,,,,,,
116,DemocracyOS,DemocracyOS é um espaço online para deliberação e votação de propostas políticas. É uma plataforma para um governo mais aberto e participativo.,DemocracyOS é um espaço online para deliberação e votação de propostas políticas. É uma plataforma para um governo mais aberto e participativo.,DemocracyOS es un espacio en línea para deliberación y votación de propuestas políticas. Es una plataforma para un gobierno más abierto y participativo.,DemocracyOS is an on-line space for deliberation and voting of political proposals. It is a platform for a more participative and open government.,http://democracyos.org/,Buenos Aires,Argentina,Internacional,Democracia en Red,Digital,Incidência,Legislativo,Participação Cidadã,,"Debate político, Legislação participativa, Votação",TRUE,,Financiadores,,,,,,,,,Banco de dados,,,,,"Legislação Participativa, Debate para consenso (a ver)"
117,Demos,"Demos es un programa que incentiva la participación responsable de l@s ciudadan@s en todos sus ámbitos de incidencia: político, social, económico, ambiental, otros.","Demos é um programa que incentiva a participação responsável d@s cidad@s em todos os seus âmbitos: político, social, econômico, ambiental, outros.","Demos es un programa que incentiva la participación responsable de l@s ciudadan@s en todos sus ámbitos de incidencia: político, social, económico, ambiental, otros.","Demos is a program that incentives responsible citizens' participation in all scopes: political, social, economic, environmental and so on.",http://www.sumando.org.ar/es/programas/demos,Buenos Aires,Argentina,Local,Sumando,Social,Empoderamento,,Cultura Política,Participação Cidadã,"Mediação / Facilitação, Ação cívica, Pedagogia política",,,Hubs,,,,,"Eventos (Seminário, Fórum, Colóquio, Conferência, Debate, Roda de Conversa e encontros )",,Curso,,,,,,,
118,Desafio Ágora Rio,O Ágora Rio é uma rede social para cidadãos e cidadãs cariocas proporem e debaterem políticas públicas com as secretarias e órgãos municipais.,O Ágora Rio é uma rede social para cidadãos e cidadãs cariocas proporem e debaterem políticas públicas com as secretarias e órgãos municipais.,El Ágora Rio es una red social para que ciudadanos y ciudadanas cariocas propongan y debatan políticas públicas con las secretarías y órganos municipales.,AgoraRio (Now Rio) is a social netowrk for citizens from Rio de Janeiro city to propose and debate public policies with municipal departments.,http://www.labrio.cc/agora.html,Rio de Janeiro,Brasil,Local,LAB.Rio,Digital,Incidência,Executivo,Governo 2.0,Participação Cidadã,"Debate político, Jogo, Mandato interativo, Co-Criação, Votação",,,,,,,,,,,,,Concurso,,,,"Co-criação, Mandado Interativo"
119,Desafio Dados Abertos,A 1ª Maratona Hacker promovida pela Câmara Municipal de São Paulo (CMSP) e pela Open Knowledge Foundation Brasil vai premiar os melhores aplicativos criados por desenvolvedores do país para facilitar a leitura e o entendimento dos Dados Abertos da CMSP pelos cidadãos paulistanos.,A 1ª Maratona Hacker promovida pela Câmara Municipal de São Paulo (CMSP) e pela Open Knowledge Foundation Brasil vai premiar os melhores aplicativos criados por desenvolvedores do país para facilitar a leitura e o entendimento dos Dados Abertos da CMSP pelos cidadãos paulistanos.,La 1ª Maratona Hacker (1º Maratón Hacker) promovida por la Cámara Municipal de São Paulo (CMSP) y por la Open Knowledge Foundation Brasil va a premiar a las mejores aplicaciones creadas por desarrolladores del país para facilitar la lectura y el entendimiento de los Datos Abiertos de la CMSP por los ciudadanos paulistanos.,"The 1ª Maratona Hacker (First Hacker Marathon), promoted by São Paulo's Municipal Chamber (CMSP) and Open Knowledge Foundation Brasil, will award the best apps created by developers in the country to facilitate reading and understanding CMSP's open data by citizens.",http://desafiodadosabertos.org/,São Paulo,Brasil,Local,Câmara Municipal de São Paulo; Open Knowledge Foundation Brasil; W3C,Social,Empoderamento,Legislativo,Governo 2.0,Transparência e Accountability,", Edital, Crowdsourcing, Hackaton",TRUE,,,,,,,Hackton,,,,,Concurso,,,,
120,Dialogando,"O Projeto Dialogando traz temas importantes como direito à privacidade, transparência governamental e liberdade de expressão na internet para o debate público das eleições de 2014 no Brasil. Levantando questões específicas sobre esses temas aos candidatos nas eleições majoritárias e proporcionais e divulgando suas respostas neste site, oferecemos material valioso a jornalistas que cobrem as eleições, a eleitores que buscam conhecer as posições de seus candidatos e aos próprios candidatos, que poderão se beneficiar de um debate nacional mais profundo, num país que é a 3ª maior democracia do planeta e que tem a 5ª maior população que usa a internet no mundo.","O Projeto Dialogando traz temas importantes como direito à privacidade, transparência governamental e liberdade de expressão na internet para o debate público das eleições de 2014 no Brasil. Levantando questões específicas sobre esses temas aos candidatos nas eleições majoritárias e proporcionais e divulgando suas respostas neste site, oferecemos material valioso a jornalistas que cobrem as eleições, a eleitores que buscam conhecer as posições de seus candidatos e aos próprios candidatos, que poderão se beneficiar de um debate nacional mais profundo, num país que é a 3ª maior democracia do planeta e que tem a 5ª maior população que usa a internet no mundo.","El Proyecto Dialogando trae temas importantes como derecho a la privacidad, transparencia gubernamental y libertad de expresión en internet para el debate público de las elecciones de 2014 en Brasil. Levantando cuestiones específicas sobre esos temas a los candidatos en las elecciones mayoritárias y proporcionales y divulgando sus respuestas en este sítio, ofrecemos material valioso a periodistas que acompañan las elecciones, a electores que buscan conocer las posiciones de sus candidatos y a los propios candidatos, que podrán beneficiarse de un debate nacional más profundo, en un país que es la 3ª mayor democracia del planeta y que tiene la 5ª mayor población que usa el internet en el mundo.","Projeto Dialogando (Dialogue Project) approaches important themes like right to privacy, governmental transparency and freedom of speech in the web, for public debate during 2014 elections in Brazil. Taking specific concerns about these themes to candidates and divulgating their answers in a website, offering very valuable material to journalists, to electors who want to know more about their candidates and to candidates themselves, who can benefit of a more profound national debate, in a country which is the third largest democracy in the world and the fifth in internet users.",http://dialogando.org/,,Brasil,Nacional,Open Knowledge Brasil; World Web Foundation,Digital,Incidência,,Transparência e Accountability,Cultura Política,", Campanha, Monitoramento",TRUE,Fiquei em dúvida sobre o método,,,,,,,Conscientização eleitoral,,Sistematização de conhecimento,Banco de dados,,,,,
121,Diálogos,"Diálogos es el proyecto común de un grupo de académicos e investigadores que se constituye con el fin de promover un espacio donde intercambiar ideas y propuestas frente a los problemas públicos en Guatemala, apoyándose en el uso de la evidencia disponible y contribuyendo a la reflexión colectiva y el debate público e informado sobre los mismos. ","Diálogos é o projeto comum de um grupo de acadêmicos e investigadores, constituído a fim de promover um espaço de troca de ideias e propostas a respeito dos problemas públicos na Guatemala, baseado no uso das informações disponíveis e contribuindo para a reflexão coletiva e o debate público e informado sobre os mesmos.","Diálogos es el proyecto común de un grupo de académicos e investigadores que se constituye con el fin de promover un espacio donde intercambiar ideas y propuestas frente a los problemas públicos en Guatemala, apoyándose en el uso de la evidencia disponible y contribuyendo a la reflexión colectiva y el debate público e informado sobre los mismos. ","Diálogos (Dialogues) is the project of a group of academics and investigators, constituted to promote a space to share ideas and proposals in regard to public problems in Guatemala, based in the use of available information and contributing to collective reflection and public debate, also providing information.",http://www.dialogos.org.gt/,,Guatemala,Nacional,,Digital,Empoderamento,,Cultura Política,,", Ensaios, Portal",,,,,,,,,,,"Estudo, Ensaio, Sistematização de conhecimento",,,,Portal de Notícias/Blog,,
122,Digital Futures UKMX,"Digital Futures UKMX is a series of exchange and collaborative prototyping/making events around the themes of civic awareness, engagement, collaboration and innovation in Mexico City and London linked with the V&A Digital Futures and Digital Design Weekend programmes and Transitio Festival in Mexico.","Digital Futures UKMX (Futuros Digitais UKMX) é uma série de eventos de intercâmbio e produção/prototipagem colaborativa acerca dos temas de consciência civil, engajamento, colaboração e inovação na Cidade do México e Londres, vinculado aos programas V&A Digital Futures and Digital Design Weekend e ao Transitio Festival no México.","Digital Futures UKMX (Futuros Digitales UKMX) es una serie de acontecimientos de intercambio y producción/prototipaje colaborativa acerca de los temas de la conciencia civil, compromiso político, colaboración e innovación en la Ciudad de México y Londres, vinculado a los programas V&A Digital Futures and Digital Design Weekend (V&A Futuros Digitales y Finde en Diseño Digital) y al Transitio Festival (Festival Transitio) en México.","Digital Futures UKMX is a series of exchange and collaborative prototyping/making events around the themes of civic awareness, engagement, collaboration and innovation in Mexico City and London linked with the V&A Digital Futures and Digital Design Weekend programmes and Transitio Festival in Mexico.",http://creativeconomy.britishcouncil.org/projects/digital-futures-ukmx/,,"México, Reino Unido",Internacional,"Laboratorio para la Ciudad de México; Centro de Cultura Digital (CCD); British Council;  Laboratorio Arte Alameda; Victoria and Albert Museum; Universidad de Dundee, Escocia,",Digital,Empoderamento,,Cultura Política,,", Oficina, Co-Criação, Seminário, Webinar",,Avaliar os Hubs.,,,,,,"Eventos (Seminário, Fórum, Colóquio, Conferência, Debate, Roda de Conversa e encontros )",,,,,,,,,Co-criação
