320,Por mi Barrio,"Esta es una plataforma para hacer reclamos por roturas y problemas que veas en la ciudad junto a vecinos y vecinas, manteniéndote al tanto del proceso de reparación. Lo llevamos adelante desde DATA (una organización de la sociedad civil) usando la plataforma de servicios abiertos de la Intendencia de Montevideo y con el apoyo de la Defensoría del Vecino.","Esta é uma plataforma para fazer relatos de problemas urbanos, que você, vizinhos e vizinhas vejam, mantendo-lhe informado da situação de reparação. Foi desenvolvido a partir do DATA (uma organização da sociedade civil), utilizando a plataforma aberta de serviços de Montevidéu e com o apoio da Defensoría del Vecino (Defensoria do Vizinho).","Esta es una plataforma para hacer reclamos por roturas y problemas que veas en la ciudad junto a vecinos y vecinas, manteniéndote al tanto del proceso de reparación. Lo llevamos adelante desde DATA (una organización de la sociedad civil) usando la plataforma de servicios abiertos de la Intendencia de Montevideo y con el apoyo de la Defensoría del Vecino.","Platform to report urban problems that you or your neighbors see, keeping you informed of repairing stage. It was developed by DATA (a civil society organization), using Montevideo's open services platform and with Defensoria del Vecino's support (Neighborhood Defense Council).",http://pormibarrio.uy/,Montevideo,Uruguai,Local,"DATA  (Datos Abiertos, Transparencia y Acceso a la información)",Digital,Incidência,Executivo,Controle Social,,", Monitoramento, Resident Feedback",,"HUB DATA: (Datos Abiertos, Transparencia y Acceso a la información)",,,,,,,,,,Georeferenciamento,,Monitoramento Descentralizado,,,Crowdsourcing
321,Por un país de propietarios,"CEDICE Libertad en alianza con la A.C. Liderazgo y Visión, desarrollan ""Por un País de Propietarios"" con el objetivo de divulgar, promover, defender, y propiciar debate y reflexión a nivel nacional sobre la importancia de los derechos de propiedad como un derecho humano irrenunciable para los ciudadanos y de crucial relevancia para su calidad de vida y el logro de su bienestar.","O Centro de Divulgación del Conocimiento Económico para la Libertad (Centro de Divulgação do Conhecimento Econômico para a LIberdade CEDICE), em parceria com a associação civil Lideranzo y Visón (Liderança e Visão), desenvolvem Por un País de Propietarios (Por um País de Proprietários), a fim de divulgar, promover, defender e propiciar o debate e a reflexão a nível nacional sobre a importância dos direitos de propriedade como um direito humano inalienável dos cidadãos e de relevância fundamental para a qualidade de vida e obtenção de bem-estar.","CEDICE Libertad en alianza con la A.C. Liderazgo y Visión, desarrollan ""Por un País de Propietarios"" con el objetivo de divulgar, promover, defender, y propiciar debate y reflexión a nivel nacional sobre la importancia de los derechos de propiedad como un derecho humano irrenunciable para los ciudadanos y de crucial relevancia para su calidad de vida y el logro de su bienestar.","Centro de Divulgación del Conocimiento Económico para la Libertad (Economic Knowledge for Freedom Divulgation Center) (CEDICE), in partnership with civil association Lireranzo y Visón (Leadership and Vision), developed by Por un País de Proprietarios (For a Country of Owners), to divulgate, promote, defend and propitiate national debate and reflection about right to property as an inalienable citizen human right and of fundamental relevance for life quality and well-being.",http://paisdepropietarios.org/home/,,Venezuela,Nacional,CEDICE,Social,Incidência,"Legislativo, Executivo",Controle Social,,"Debate político, Campanha, Advocacy",false,,,,,,,,,,Sistematização de conhecimento,,,Indicadores,Portal de Notícias/Blog,,
322,Portal Brasileiro de Dados Abertos,O Portal Brasileiro de Dados Abertos é a ferramenta disponibilizada pelo governo para que todos possam encontrar e utilizar os dados e as informações públicas. O portal preza pela simplicidade e organização para que você possa encontrar facilmente os dados e informações que precisa. O portal também tem o objetivo de promover a interlocução entre atores da sociedade e com o governo para pensar a melhor utilização dos dados em prol de uma sociedade melhor.,O Portal Brasileiro de Dados Abertos é a ferramenta disponibilizada pelo governo para que todos possam encontrar e utilizar os dados e as informações públicas. O portal preza pela simplicidade e organização para que você possa encontrar facilmente os dados e informações que precisa. O portal também tem o objetivo de promover a interlocução entre atores da sociedade e com o governo para pensar a melhor utilização dos dados em prol de uma sociedade melhor.,El Portal Brasileiro de Dados Abertos (Portal Brasileño de Datos Abiertos) es una herramienta disponibilizada por el gobierno para que todos puedan encontrar y utilizar los datos y las informaciones públicas. El portal se caracteriza por su simplicidad y organización para que tú puedas encontrar fácilmente los datos e informaciones que necesitas. El portal también tiene por objetivo promover la interlocución entre actores de la sociedad y el gobierno para pensar la mejor forma de utilizar los datos para una sociedad mejor.,Portal Brasileiro de Dados Abertos (Brazilian Portal of Open Data) is a tool made available by government so everybody can find and use public data and information. The portal values simplicity and organization to make data and information easy to find. It also intends to promote dialogue between society and govern to design the best use of data for a better society.,http://dados.gov.br/,,Brasil,Nacional,Governo Federal,Digital,Empoderamento,,Governo 2.0,Transparência e Accountability,", Banco de dados, Repositório, Big data",TRUE,,,,,,,,,,,Banco de dados,,,,,
323,Portal de Servicios Ciudadanos,Consulte aquí los principales servicios en línea ofrecidos por instituciones públicas de Costa Rica,Consulte aqui os principais serviços online oferecidos por instituições públicas de Costa Rica.,Consulte aquí los principales servicios en línea ofrecidos por instituciones públicas de Costa Rica,Consult here the main on-line services offered by public institutions in Costa Rica.,http://gob.go.cr/es,,Costa Rica,Nacional,Gobierno de la Federación de Costa Rica,Digital,Empoderamento,,Governo 2.0,,", Repositório, Infográfico, Serviço digital",,,,,,,,,,,,Banco de dados,,,,,Mandado Interativo
324,Portal de Transparencia Estándar Peru,Portal de transparencia y accesso a datos del Gobierno de Perú,Portal de transparência e acesso a dados do Governo do Peru.,Portal de transparencia y accesso a datos del Gobierno de Perú,Transparency and data access portal of Peru Government.,http://www.peru.gob.pe/transparencia/pep_transparencia.asp,,Peru,Nacional,Governo Federal de Peru,Digital,Empoderamento,,Governo 2.0,Transparência e Accountability,", Repositório, Portal, Monitoramento, Serviço digital",,,,,,,,,,,,Banco de dados,,Indicadores,,,
325,Portal Nacional de Datos Abiertos,"Es el portal de acceso a datos públicos de más de 20 instituciones participantes en la iniciativa de “Gobierno Abierto”. Provee las herramientas necesarias para automatizar el proceso de publicación de datos, en línea y en tiempo real innovando y creando utilidad para los diferentes sectores del país. Mediante esto, se genera transparencia y se facilita el acceso a información pública.","É o portal de acesso a dados públicos de mais de 20 instituições participantes da iniciativa ""Governo Aberto"". Ele fornece as ferramentas necessárias para automatizar o processo de publicação de dados online e em tempo real, inovando e criando valor para os diferentes setores do país. Desta forma, gera-se transparência e facilita-se o acesso à informação pública.","Es el portal de acceso a datos públicos de más de 20 instituciones participantes en la iniciativa de “Gobierno Abierto”. Provee las herramientas necesarias para automatizar el proceso de publicación de datos, en línea y en tiempo real innovando y creando utilidad para los diferentes sectores del país. Mediante esto, se genera transparencia y se facilita el acceso a información pública.","It is the site to access public data of over 20 institutions participant of Open Government. It provides necessary tools to automatize proccess of on-line real time data publishing, innovating and creating value to different sectors. This way, generates transparency and makes access to public information easier.",http://datosabiertos.gob.go.cr/home/,,Costa Rica,Nacional,Gobierno Federal de Costa Rica,Digital,Empoderamento,,Governo 2.0,Transparência e Accountability,", Banco de dados, Repositório",,,,,,,,,,,,Banco de dados,,,,,
326,Portal Paraguay,"Portal Paraguay se constituye como la ventanilla única de acceso a toda la información, servicios y trámites ofrecidos por las instituciones del Estado Paraguayo en un solo  punto de acceso, en cualquier momento, las 24 horas del día, utilizando cualquier dispositivo y desde cualquier punto país y del mundo.","Portal Paraguay (Portal Paraguai) constitui-se em portal único de acesso a todas as informações, serviços e operações oferecidos por instituições do Estado paraguaio em um único ponto de acesso, a qualquer momento, 24 horas por dia, utilizando qualquer dispositivo em qualquer lugar do país e do mundo.","Portal Paraguay se constituye como la ventanilla única de acceso a toda la información, servicios y trámites ofrecidos por las instituciones del Estado Paraguayo en un solo  punto de acceso, en cualquier momento, las 24 horas del día, utilizando cualquier dispositivo y desde cualquier punto país y del mundo.","Portal Paraguay is the unified gateway to access all information, services and operations of Paraguay State, at any time, 24 hours a day, from anywhere in the world.",http://www.paraguay.gov.py/,,Paraguai,Nacional,Gobierno de Paraguay,Digital,Empoderamento,,Governo 2.0,,", Serviço digital",TRUE,,,,,,,,,,,,,,Portal de Notícias/Blog,,Mandado Interativo
327,Portal Único de Transparência,"El portal único de transparencia es una plantilla uniforme diseña para presentar la información de oficio de las instituciones obligada. Lo que se busca es que el usuario pueda navegar y encontrar la información de la misma manera sin importar que institución visite, facilitando de esta manera la usabilidad en la navegación al usuario final. ","O portal único de transparência é um modelo uniforme, projetado para apresentar informações públicas das instituições vinculadas. O que se busca é que o usuário possa navegar e encontrar informações similarmente,não importa qual instituição esteja visitando, facilitando assim a navegação para o usuário final.","El portal único de transparencia es una plantilla uniforme diseña para presentar la información de oficio de las instituciones obligada. Lo que se busca es que el usuario pueda navegar y encontrar la información de la misma manera sin importar que institución visite, facilitando de esta manera la usabilidad en la navegación al usuario final. ","Unique Transparency Portal is an uniform model, designed to present public information of indexed institutions. The search allows user to navigate and find information, no matter which institution user is visiting, making it easier.",http://portalunico.iaip.gob.hn/,,Honduras,Nacional,Instituto de Acceso a la Información Publica - SINAIP,Digital,Empoderamento,,Governo 2.0,Transparência e Accountability,", Banco de dados, Repositório, Serviço digital",false,,"Sinais, Hubs",,,,,,,,,Banco de dados,,,,,
328,Prêmio Cadeado de Chumbo,"Cinco candidatos disputam palmo a palmo o prêmio “Cadeado de Chumbo”, que irá premiar o órgão público que mais “enrolou” para responder — ou não responder — um pedido de informação feito com base na Lei de Acesso à Informação.","Cinco candidatos disputam palmo a palmo o prêmio “Cadeado de Chumbo”, que irá premiar o órgão público que mais “enrolou” para responder — ou não responder — um pedido de informação feito com base na Lei de Acesso à Informação.","Cinco candidatos disputan palmo a palmo el premio Cadeado de Chumbo (Candado de Plomo), el cual premiará al público que más ""se demoró"" para responder - o ni respondió - un pedido de información hecho con base en la Lei de Acesso à Informação (Ley de Acceso a la Información).","Five candidates disputed inch per inch the prize Cadeado de Chumbo (Lead Locker), which award the public organ which took longer to respond - or even not respond - for an information request based on Lei de Acesso à Informação (Information Access Law). ",http://retps.org.br/?p=478,,Brasil,Nacional,Rede pela Transparência e Participação Social,Digital,Incidência,,Transparência e Accountability,,", Ativismo digital, Denúncia, Monitoramento, Consulta popular",,,,,,,,,"Humor, Campanha de Sensibilização",,,,,Indicadores,,Manifestação,
329,Programa Cidades Sustentáveis,"O Programa Cidades Sustentáveis oferece aos gestores públicos uma agenda completa de sustentabilidade urbana, um conjunto de indicadores associados a esta agenda e um banco de práticas com casos exemplares nacionais e internacionais como referências a serem perseguidas pelos municípios.","O Programa Cidades Sustentáveis oferece aos gestores públicos uma agenda completa de sustentabilidade urbana, um conjunto de indicadores associados a esta agenda e um banco de práticas com casos exemplares nacionais e internacionais como referências a serem perseguidas pelos municípios.","El Programa Cidades Sustentáveis (Programa Ciudades Sostenibles) ofrece a los gestores públicos una agenda completa de sostenibilidad urbana, un conjunto de indicadores asociados a esta agenda y un banco de prácticas con casos ejemplares nacionales e internacionales como referencia para que sean seguidos por los municipios.","Programa Cidades Sustentáveis (Sustainable City Program) offers public managers a complete agenda of urban sustainability, a set of associated idexes comes with this agenda and also a database of practices with national and international examples as references to be followed by municipalities.",http://www.cidadessustentaveis.org.br/,,Brasil,Local,Instituto Ethos; Rede Nossa São Paulo; Rede Social Brasileira por Cidades Justas e Sustentáveis,Digital,Incidência,Executivo,Controle Social,,", Advocacy, Index/Indicadores, Estudos",false,,,,,,,,,,Estudo,,,Indicadores,,Advocacy,
330,Programa de Becarios,"Este programa busca proporcionar apoyo a largo plazo para fortalecer la alfabetización de datos entre la sociedad civil, organizaciones y periodistas de todo el Perú.",Este programa visa proporcionar apoio a longo prazo para fortalecer a alfabetização de dados entre organizações da sociedade civil e jornalistas de todo o Peru.,"Este programa busca proporcionar apoyo a largo plazo para fortalecer la alfabetización de datos entre la sociedad civil, organizaciones y periodistas de todo el Perú.",This program aims to provide long term support to fortify data alphabetization among civil society organizations and journalists of Peru.,http://odpe.org/content/programa-2015,,Peru,Nacional,Open Data Perú,Social,Empoderamento,,Comunicação Independente,,", Vivência, Curso, Infoativismo",,,,,,,,,,Vivência,,,Aceleração e Incubação,,,,
331,Programa de Incidencia,"El Programa de Incidencia nacional y regional se orienta a mejorar la capacidad de la sociedad organizada para influir en las decisiones vinculadas al fortalecimiento de la democracia, el desarrollo territorial inclusivo y la descentralización. Nos proponemos generar una amplia corriente de opinión a favor de la democratización de la sociedad, el Estado y la economía.","O Programa de Incidencia (Programa de Impacto), nacional e regional, visa melhorar a capacidade da sociedade organizada para influenciarnas decisões relacionadas ao fortalecimento da democracia, ao desenvolvimento territorial inclusivo e à descentralização. Temos a intenção de criar uma ampla corrente de opinião em favor da democratização da sociedade, do Estado e da economia.","El Programa de Incidencia nacional y regional se orienta a mejorar la capacidad de la sociedad organizada para influir en las decisiones vinculadas al fortalecimiento de la democracia, el desarrollo territorial inclusivo y la descentralización. Nos proponemos generar una amplia corriente de opinión a favor de la democratización de la sociedad, el Estado y la economía.","Programa de Incidencia (Incidence Program), national and regional, aims to improve organized society capability of influencing decisions related with democracy strengthening, inclusive territorial development and decentralization. We intend to create a wide opinion chain in favor of society, State and economy democratization.",http://www.propuestaciudadana.org.pe/programa-de-incidencia,,Peru,Nacional,Propuesta Ciudadana,Social,Incidência,"Legislativo, Executivo",Participação Cidadã,,"Assembléia, Debate, Legislação participativa, Co-Criação",,,,,,,,,,,"Estudo, Análise de Dados",,,,,Advocacy,
332,Programa de Metas,Acompanhe as metas definidas pela Prefeitura de São Paulo para a gestão 2013-2016.,Acompanhe as metas definidas pela Prefeitura de São Paulo para a gestão 2013-2016.,Siga las metas definidas por la Alcaldía de São Paulo para la gestión 2013-2016.,Follow goals determined by São Paulo City Hall for 2013-2016 term.,http://planejasampa.prefeitura.sp.gov.br/metas/,São Paulo,Brasil,Local,Prefeitura de São Paulo,Digital,Empoderamento,,Governo 2.0,Controle Social,", Index/Indicadores, Análise de dados, Relatório, Repositório, Infográfico, Monitoramento, Serviço digital",,,,,,,,,,,,,,Indicadores,,,
333,Programa Participación y Formación,"El Programa de Participación y Formación trabaja en la promoción y consolidación de mecanismos de articulación de la sociedad civil para el debate y la definición de políticas públicas a través de la promoción de encuentros, foros y espacios de diálogo con plataformas regionales, nacionales e internacionales.","O Programa de Participación y Formación (Programa de Participação e Formação) trabalha na promoção e consolidação dos mecanismos de articulação da sociedade civil para a discussão e a definição de políticas públicas, por meio da organização de reuniões, fóruns e espaços de diálogo com plataformas regionais, nacionais e internacionais.","El Programa de Participación y Formación trabaja en la promoción y consolidación de mecanismos de articulación de la sociedad civil para el debate y la definición de políticas públicas a través de la promoción de encuentros, foros y espacios de diálogo con plataformas regionales, nacionales e internacionales.","Programa de Participación y Formación (Participation and Formation Program) works in the promotion and consolidation of civil society articulation mechanisms to discuss and define political policies, through organization of meetings, forums and dialogue spaces with regional, national and international platforms.",http://www.propuestaciudadana.org.pe/programa-participacion-y-formacion,,Peru,Nacional,Propuesta Ciudadana,Social,Empoderamento,,Cultura Política,Participação Cidadã,"Debate, Roda de conversa, Pedagogia política, Curso, Mandato interativo, Legislação participativa, Co-Criação",,,,,,,,,,Oficina,,,,,,,
334,Programa Vigilancia Ciudadana,"El sistema Vigila Perú que se conduce desde el Programa Vigilancia Ciudadana, funciona con un modelo descentralizado de organización, manteniendo un flujo de información y comunicación con cada una de las instituciones socias que son responsables de las acciones de vigilancia en las regiones.","O sistema Vigila Perú (Vigia Peru), desenvolvido a partir do Programa Vigilancia Ciudadana (Programa Vigilância de Cidadã), trabalha com um modelo de organização descentralizada, mantendo um fluxo de informação e comunicação com cada uma das instituições parceiras que são responsáveis por atividades de fiscalização nas regiões.","El sistema Vigila Perú que se conduce desde el Programa Vigilancia Ciudadana, funciona con un modelo descentralizado de organización, manteniendo un flujo de información y comunicación con cada una de las instituciones socias que son responsables de las acciones de vigilancia en las regiones.","Vigila Perú (Peru Watch) system, developed from Programa Vigilancia Ciudadana (Citizen Vigilance Program), works with a decentralized organization model, keeping information and communication flow with each one of partner institutions, which are responsible for watching activities in different regions.",http://www.propuestaciudadana.org.pe/programa-vigilancia-ciudadana,,Peru,Local,Propuesta Ciudadana,Social,Empoderamento,,Controle Social,,", Estudos, Análise de dados, Monitoramento",,,,,,,,,,,"Estudo, Análise de Dados","Banco de dados, Gráficos",,,,,
335,Projeto Brasil,"O Projeto Brasil é uma startup que tem como proposta tornar a política brasileira mais transparente, competente e democrática, informando, engajando e aproximando políticos e cidadãos. Por meio de tecnologias, permite que o cidadão acompanhe a execução das propostas feitas pelos candidatos durante as eleições e durante as eleições permite que o cidadão possa conhecer melhor as propostas de seus candidatos e faça uma melhor escolha. ","O Projeto Brasil é uma startup que tem como proposta tornar a política brasileira mais transparente, competente e democrática, informando, engajando e aproximando políticos e cidadãos. Por meio de tecnologias, permite que o cidadão acompanhe a execução das propostas feitas pelos candidatos durante as eleições e durante as eleições permite que o cidadão possa conhecer melhor as propostas de seus candidatos e faça uma melhor escolha. ","El Proyecto Brasil es una startup que tiene como propuesta tornar la política brasileña más transparente, competente y democrática, informando, comprometiendo y aproximando a políticos y ciudadanos. Por medio de tecnologías, permite que los ciudadanos sigan la ejecución de propuestas hechas por los candidatos durante las elecciones y durante las elecciones permite que el ciudadano pueda conocer mejor las propuestas de sus candidatos y, así, pueda escoger mejor.","Projeto Brasil (Brazil Project) is a startup that seeks to make Brazilian potilitcs more transparent, competent and democratic, though information, engagement and aproximating politics and citizens. A set of technologies allows citizen to follow execution of propositions made by candidates in the elections and during elections allows citizens to know propositions in detail to make a better choice.",http://www.projetobrasil.org/,,Brasil,Nacional,,Digital,Empoderamento,"Legislativo, Executivo",Cultura Política,Controle Social,", Campanha, Co-Criação",,,,,,,,,Conscientização eleitoral,,,,,,,,Co-criação
336,Proyecto Formación Social y Política,"El proyecto busca desarrollar un Plan de Formación Social y Política dirigido a jóvenes y adultos, líderes locales y de organizaciones sociales con el propósito de facilitarles a través de distintas actividades educativas, procesos de fortalecimiento en gerencia política, administración de proyectos sociales y comunitarios, así como en liderazgo democrático. ","O projeto busca desenvolver um Plano de Educação Social e Política destinado a jovens e adultos, líderes locais e organizações sociais, com o objetivo de facilitar, através de várias atividades educacionais, processos de fortalecimento da gestão política, gestão de projetos sociais e comunitários, bem como a liderança democrática.","El proyecto busca desarrollar un Plan de Formación Social y Política dirigido a jóvenes y adultos, líderes locales y de organizaciones sociales con el propósito de facilitarles a través de distintas actividades educativas, procesos de fortalecimiento en gerencia política, administración de proyectos sociales y comunitarios, así como en liderazgo democrático. ","The project aims to develop a Social Education and Politics Plan destined to young and adults, local leaders and social organizations, through numerous educational activities, processes of political management strengthening, management of social and community projects, as well as democratic leadership.",http://www.aldhonduras.org/formacionsocial.html,Tegucigalpa,Honduras,Nacional,Asociación Libertad y Democracia,Social,Empoderamento,"Legislativo, Judiciário, Executivo",Cultura Política,Participação Cidadã,", Vivência, Pedagogia política, Curso",,,,,,,,,,Curso,,,,,,,
